Judul,Penulis,Pembimbing 1,Pembimbing 2,Abstrak
Aplikasi Penerjemah Bahasa Madura-Indonesia Dan Indonesia-Madura Menggunakan Free Contex Parsing Algorithm,Penulis : Rahilah,"Dosen Pembimbing I : Firdaus Solihin, S.Kom.,M.Kom","Dosen Pembimbing II :Fika Hastarita Rachman,S.T.,M.Eng","Bahasa Madura sebagai salah satu bahasa daerah di Indonesia sudah mulai kehilangan identitas. Hal ini disebabkan minimnya pengetahuan dan sedikitnya pola pelestarian terhadap Bahasa Madura. Oleh karena itu, perlu adanya pola pembelajaran yang lebih efektif agar transformasi pengetahuan terus berjalan. Salah satunya dengan membuat aplikasi penerjemah Bahasa Madura-Indonesia dan juga sebaliknya. Untuk dapat menerjemahkan kata ataupun kalimat tersebut, dalam penelitian ini digunakan metode Free Context Parsing Algorithm. Dengan adanya aplikasi ini dapat menjadi referensi dalam mempelajari dan meningkatkan kemampuan berbahasa, mulai dari tingkatan Bahasa Madura yang paling umum (Enje’-Iyeh) hingga ke tingkatan Bahasa Madura yang paling halus (Engghi-Bunten), sehingga Bahasa Madura dapat bertahan dan lebih dikenal oleh masyarakat Madura maupun masyarakat luar Madura. Karena aplikasi yang berbasis web ini mampu menerjemahkan bahasa mulai dari Bahasa Madura ke Bahasa Indonesia dan dari Bahasa Indonesia ke Bahasa Madura. Dari hasil pengujian yang dilakukan terhadap beberapa kalimat dan dokumen, sistem ini sudah dapat dimengerti dan hasilnya cukup baik. Hal ini dibuktikan dengan  rata-rata nilai presisi yang diperoleh sebesar 90%. Namun, masih terdapat kekurangan pada hasil terjemahan yang belum sempurna dari segi tata Bahasa Madura.

Kata kunci: Aplikasi Penerjemah Bahasa, Free Contex Parsing Algorithm."
PENERAPAN MODIFIKASI METODE ENHANCED CONFIX STRIPPING STEMMER PADA TEKS BERBAHASA MADURA,Penulis : Andi Sholihin,"Dosen Pembimbing I : Firdaus Solihin, S.Kom.,M.Kom.","Dosen Pembimbing II :Fika Hastarita Rachman, S.T., M.Eng","Stemming adalah teknik untuk menemukan kata dasar dari sebuah kata yang telah mengalami imbuhan dengan cara menghilangkan atau menghapus imbuhan-imbuhan tersebut. Algoritma Enhanced Confix Stripping Stemmer adalah algoritma stemming yang akurat untuk mencari bentuk dasar dari suatu kata dalam Bahasa Indonesia. Bahasa Madura memiliki struktur morfologi yang mirip dengan Bahasa Indonesia. Bahasa Madura memiliki kata yang dapat dibentuk dari awalan (ter-ater), akhiran (panoteng) dan sisipan (sesselan) dan Kata Ulang (Rangkebbhan). Modifikasi algoritma Enhanced Confix Stripping Stemmer dilakukan pada tabel aturan pemenggalan, langkah-langkah algoritma dan penambahan langkah algoritma sesuai dengan morfologi Bahasa Madura. Dengan demikian dapat dihasilkan sebuah algoritma baru yang dikembangkan dari algoritma Enhanced Confix Stripping Stemmer. Setelah melakukan beberapa analisa dan pengujian dengan menggunakan sistem yang telah dibangun maka diperoleh hasil dari modifikasi algoritma Enhanced Confix Stripping Stemmer pada teks berbahasa Madura. Persentase kata Bahasa Madura yang berhasil distemming adalah 95,75 %  dari 400 kata yang diuji. Dengan demikian modifikasi Enhanced Confix Stripping Stemmer pada teks berbahasa Madura dinilai efektif untuk diterapkan."
PENJADWALAN PRODUKSI ROKOK MENGGUNAKAN METODE SHORTEST PROCESSING TIME UNTUK MENDUKUNG PENERAPAN SUPPLY CHAIN MANAGEMENT,Penulis : Erwin Andriyansyah,"Dosen Pembimbing I : Ba’in Khusnul Khotimah, ST., M.Kom.","Dosen Pembimbing II :Yeni Kustiyahningsih, S.kom., M.kom.","Dalam pola supply chain management terdapat aktivitas penjadwalan produksi. Perubahan penjadwalan pada produksi merupakan hal yang sering terjadi untuk memenuhi permintaan konsumen, Penjadwalan produksi merupakan salah satu fungsi dari pengawasan produksi yang mempunyai peranan yang cukup penting dalam  memaksimalkan pendapatan penjualan, dan meminimalkan biaya produksi, dan proses produksi akan berjalan dengan efisien. Sedangkan proses produksi berjalan dengan efisien, maka proses supply chain management mengalir dengan lancar. Permasalahan yang ada di perusahaan rokok gudang alam, tidak adanya penjadwalan produksi pada perusahaan tersebut, dan pihak sales tidak tahu kapan barang akan dikirim. Dan pihak pemesan atau agen tidak mengetahui kapan barangnya bisa diterima, sehingga proses supply chain management tidak berjalan dengan baik. Dalam penelitian ini, diadakan   pengalokasian bahan-bahan baku dan bahan-bahan pembantu, serta kelengkapan pengolahan  di setiap instalasi atau fasilitas yang telah ditentukan untuk menunjang proses supply chain berjalan dengan baik. Hasil dari penjadwalan meliputi jumlah produk yang dihasilkan dan pengolahan pada produk tersebut, terutama pada bagian yang didahulukan dalam proses produksi untuk melakukan penjadwalan produksi rokok. Yang pada pengurutannya menggunakan metode shortest processing time, menghasilkan penjadwalan produksi rokok yang meminimalisir keterlambatan sesuai dengan permintaan konsumen.

Kata Kunci: Penjadwaln produksi, Shortest Processing Time, supply chain management"
Sistem Pemilihan Supplier di Apotek Menggunakan Metode Fuzzy Analytical Network Process (FANP),Penulis : Erwanto Indra Sasmita,"Dosen Pembimbing I : Firli Irhamni, ST., M.Kom.","Dosen Pembimbing II :Diana Rahmawati, S.T, M.T.","Kegiatan yang dilakukan di apotek yaitu transaksi penjualan obat kepada konsumen dan pembelian obat dari supplier. Karena suplier yang datang banyak, maka pihak apotek harus memilih suplier yang tepat, supaya usaha apotek dapat berjalan lancar. Untuk menyelesaikan permasalaha n di atas, pada penelitian ini dilakukan pendekatan Fuzzy Analytical Network Process (FANP) untuk memilih supplier obat terbaik untuk apotek. Penggunaan fuzzy bertujuan untuk mengakomodasi sifat samar dalam pengambilan keputusan untuk memberikan pertimbangan yang dapat mengatasi ketidakpastian didalam kriteria-kriteria kualitatif. Metode FANP dapat digunakan untuk menyelesaikan permasalahan pengambilan keputusan yang terdapat hubungan saling mempengaruhi antar kriteria dalam suatu level tertentu. Proses penghitungan FANP terhadap 5 supplier apotek Yakersuda yaitu Kallista, APL, AAM, Parit Padang dan Barito memperoleh hasil akhir bahwa terdapat 4 supplier yang mempunyai target sesuai dengan penilaian dari tiap kriteria dari perbandingan semua alternatif. Kriteria yang terpilih yaitu kualitas obat, ketepatan waktu, ketepatan jumlah, pengemasan, sistem komunikasi dan kerjasama, prosedur pembayaran, frekuensi pengiriman dan harga obat. Supplier yang terpilih yaitu Kallista, APL, AAM dan Barito dengan nilai bobot secara berturut-turut 3,19;3,19;3,19 dan 3,11. Hasil pemilihan tersebut memperoleh nilai prosentase sebesar 80% dari hasil verifikasi uji sistem.
Kata kunci: Sistem Pendukung Keputusan, Apotek, Perangkingan Supplier, Fuzzy Analytical Network Process (FANP)"
RANCANG BANGUN SISTEM PERAMALAN DISTRIBUSI BERAS MENGGUNAKAN METODE EXPONENTIAL SMOOTHING,Penulis : hendra pramana putra,"Dosen Pembimbing I : fika hastarita. S.T., M.Eng","Dosen Pembimbing II :bain khusnul khotimah, S.T., M.Kom","Salah satu komponen penting yang menunjang operasi perusahaan beras adalah 
kegiatan memprediksi jumlah beras yang dibutuhkan konsumen. Dengan prediksi 
yang baik dapat dibuat rencana kerja perusahaan lebih efektif dan efisien.  Proses 
pendistribusian juga harus tepat agar tidak terjadi penumpukan beras di gudang yang 
megakibatkan kwalitas beras menurun.  Selain itu  pemasukan beras  dan distribusi 
beras juga harus seimbang supaya terjadi keseimbangn dalam proses distribusi beras. 
Penelitian ini  mengidentifikasi pola distribusi beras  di BULOG kabupaten 
Pamekasan. agar  mendapatkan metode peramalan yang terbaik berdasarkan pola data 
pendistribusian beras. Selain itu sistem yang di buat juga mampu mendapatkan hasil 
peramalan  periode selanjutnya  sehingga dapat menjadi acuan dalam perencanaan 
strategi pendistribusian yang  diterapkan di Bulog  Kabupaten  Pamekasan.  Dalam 
proses pendistribusian  beras  Penentuan metode  exponential smooting  sebagai 
peramalan yang terbaik  dengan menggunakan data sebelumnya sebagai parameter 
masukan  dilakukan dengan  cara mengukur tingkat kesalahan  peramalan  dari 
penerapan  metode tersebut  dan di ketahui peramalan terbaik berada di  alpha  0.1 
dengan mengidentifikasi nilai Square Error  (SE) dan Percentage Error  (PE). Dapat 
diketahui melalui pencarian nilai rata-rata kesalahan sebesar 3.8%, yaitu menghitung 
Mean Square Error (MSE) dan Mean Absolute Percentage Error (MAPE). 
 
 Kata kunci:  Peramalan Pendistribusian, Exponential Smoothing, Mean Error (MSE) 
Mean Absolute Percentage Error (MAPE)"
SISTEM PERAMALAN TINGKAT PENGANGGURAN WILAYAH BANGKALAN MENGGUNAKAN ALGORITMA BACKPROPAGATION,Penulis : ALI IMRON ZAMZAMI,"Dosen Pembimbing I : Ba'in Khusnul Khotimah, S.T., M.Kom.","Dosen Pembimbing II :Firli Irhamni, S.T., M.Kom.","Kabupaten Bangkalan Mempunyai jumlah penduduk tahun 2010 sebanyak 906.761 yang diikuti dengan jumlah pengangguran yang cukup tinggi, tentunya pengangguran menjadi masalah sosial yang harus diperhatikan.  Berdasarkan permasalahan tersebut maka perlu adanya sistem peramalan sehingga bisa menekan angka pengangguran di Kabupaten Bangkalan. Sistem ini dibuat menggunakan Algoritma Backpropagation yang mampu melakukan penyesuaian bobot penghubung sehingga dapat dijadikan solusi untuk menentukan jumlah pengangguran. Jaringan-jaringan dilatih dengan menggunakan beberapa variabel masukan yaitu : data tahun 2006-2010. Setelah Sistem peramalan dengan menggunakan Algoritma Backpropagation ini melalui proses uji coba didapatkan nilai konfigurasi parameter terbaik ialah konfigurasi lerning rate sebesar 0.7 toleransi error 0.1, maksimal epoch 50 dan hidden layer 14.  Parameter tersebut dipilih menjadi parameter terbaik karena menghasilkan jumlah iterasi yang memiliki nilai akurasi error terbaik saat sistem melakukan pengujian yaitu didapatkan MSE sebesar 37206,6 dan MAPE sebesar 1,34% yang mana diperoleh jumlah pengangguran di Kabupaten Bangkalan pada tahun 2010 adalah 24.637 jiwa. Sedangkan pendataan jumlah pengangguan tahun 2010 yang dilakukan oleh BPS Kabupaten Bangakalan adalah 25008 jiwa.
	
Kata Kunci: Peramalan, Algoritma Backpropagation, Pengangguran."
PENDETEKSIAN MINUTIAE PADA SIDIK JARI MENGGUNAKAN CROSSING NUMBER,Penulis : Yanto Erwanto,"Dosen Pembimbing I : Dr. Arif Muntasa, S.Si.,M.T","Dosen Pembimbing II :Rima Tri Wahyuningrum, S.T.,M.T","PENDETEKSIAN MINUTIAE PADA SIDIK JARI
MENGGUNAKAN CROSSING NUMBER


ABSTRAK

Berbagai penelitian tentang citra sidik jari, telah banyak dilakukan. Mulai dari pendeteksian, pengklasifikasian sampai dengan pengenalan pola sidik jari. Hal ini dikarenakan keunikan yang dimiliki oleh sidik jari yang dapat dijadikan sebagai pengenalan identitas seseorang.
Salah satu fitur dalam pengenalan sidik jari adalah kesamaan letak minutiae pada sidik jari seseorang. Minutiae didefinisikan sebagai titik-titik akhir dan titik-titik awal percabangan dari garis-garis alur (ridge) yang memberikan informasi yang unik dari suatu sidik jari [7]. Secara umum minutiae terbagi menjadi dua macam yaitu minutiae termination yang merupakan tempat ridge berakhir dan minutiae bifurcation yang merupakan tempat ridge memisah atau bercabang.Pada penelitian ini membahas tentang bagaimana mendeteksi letak minutiae pada sidik jari dengan menggunakan metode Crossing Number dengan menggunakan dua skenario pada proses binaryzation. Skenario pertama menggunakan nilai treshold = nilai mean piksel citra, dan skenario kedua menggunakan nilai treshold = 80. Langkah pertama dalam penelitian ini yaitu dengan memasukkan citra sidik jari (load image). Selanjutnya dilakukan grayscaling, binaryzation, thinning, dan block filter. Langkah terakhir, deteksi minutiae melalui ekstraksi minutiae dengan menggunakan crossing number. Dari hasil uji coba diperoleh Pendeteksian minutiae termination menggunakan skenario kedua lebih baik dibandingkan dengan skenario pertama dengan rata-rata akurasi 96,22%. Sedangkan untuk pendeteksian minutiae bifurcation, skenario pertama lebih baik dibandingkan dengan skenario kedua dengan rata-rata akurasi 46,28%. 

Kata kunci : minutea, minutiae bifurcation, minutiae termination, crossing number."
EKSTRAKSI PENAMBAHAN STOPLIST DARI KATA UMUM DOKUMEN HASIL KLASIFIKASI PRETOPOLOGY,Penulis : Mohammad Mastur,"Dosen Pembimbing I : Fika Hastarita Rachman, ST.,MEng.","Dosen Pembimbing II :Firdaus Solihin, SKom.,Mkom.","Dokumen teks bahasa Indonesia sangat melimpah dan setiap waktu bertambah. Dalam proses pencarian, banyak dokumen yang dihasilkan menjadi kurang relevan jika tidak sesuai dengan keinginan pengguna. Stopword merupakan kata yang “tidak relevan”, namun sering muncul dalam dokumen. Kumpulan stopword disebut stoplist. Pada sistem temu balik informasi, asumsi yang ada adalah dengan menghapus stoplist, maka mengurangi jumlah kata yang akan diproses. Sedangkan kata umum juga sering digunakan pada bidang tertentu. Sehingga perlu dilakukan ekstraksi kata umum dari dokumen hasil klasifikasi dan melakukan perbandingan efektifitas antara aplikasi pencarian-1 menggunakan penghapusan stoplist dengan aplikasi pencarian-2 menggunakan penghapusan stoplist dan kata umum untuk meningkatkan relevansi dan waktu proses pencarian dokumen. Hasil uji coba klasifikasi pretopology dengan 25 dokumen teknik, 25 ekonomi dan 25 pertanian diperoleh nilai rata-rata recall dan precision sebesar 90% dan 76%. Uji coba pencarian dengan 6 query terhadap 285 dokumen teknik, 193 ekonomi dan 268 pertanian pada aplikasi pencarian-1 diperoleh nilai rata-rata recall, precision, f-measure dan waktu proses adalah 96.7%, 22.5%, 30.6% dan 0.239 detik. Sedangkan aplikasi pencarian-2 dengan threshold kata umum 1% adalah 96%, 67%, 76.5% dan 0.098 detik. Sehingga dapat dikatakan bahwa aplikasi pencarian-2 lebih efektif dari pada aplikasi pencarian-1.
Kata kunci: Sistem temu balik informasi, Stoplist, Klasifikasi Pretopology, Kata Umum."
Rancang Bangun sosial media sebagai software as a service untuk media pembelajaran dan test TOEFL,Penulis : muhammad reza kembara r.pa,"Dosen Pembimbing I : Hermawan S.T.,M.Kom","Dosen Pembimbing II :Bain Khusnul Khotimah S.Kom.,M.Kom",
Analisa Pemilihan Alat Kontrasepsi Dengan Menggunakan Metode Naive Bayes,Penulis : Ratih Marcelina,Dosen Pembimbing I : Firli Irhamni,Dosen Pembimbing II :Muhammad Ali Syakur,"KB adalah singkatan dari Keluarga Berencana. Menurut Kamus besar Bahasa Indonesia (1997), KB adalah “Gerakan untuk membentuk keluarga yan sehat dan sejahtera dengan mengatur kehamilan”. Dengan kata lain KB adalah perencanaan jumlah keluarga. Pengaturan bisa dilakukan dengan penggunaan alat-alat kontrasepsi atau penanggulangan kehamilan seperti pil, suntik, IUD, dan sebagainya. Jumlah anak di anggap ideal adalah dua anak.Dalam proses penentuan pemilihan alat kontrasepsi tersebut memerlukan  Metode peramalan yang digunakan dalam sistem ini adalah metode Naïve bayes classifer untuk menghitung jumlah ketepatan dalam menentukan pilihan alat kontrasepsi. Aplikasi sistem pendukung keputusan dengan Naïve bayes classifer dapat dijadikan solusi untuk menentukan alat kontrasepsi, Nilai konfigurasi parameter untuk sistem pendukung keputusan dengan menggunakan Naïve bayes classifer.

Kata Kunci : Alat Kontrasepsi, Sistem Pendukung Keputusan,  Naïve bayes classifer"
EKSTRAKSI FITUR PRINCIPAL COMPONENT ANALYSIS (PCA) UNTUK PENGENALAN HURUF ABJAD BAHASA ISYARAT PADA SISTEM ISYARAT BAHASA INDONESIA (SIBI),Penulis : Adelia Kusuma Wardani,"Dosen Pembimbing I : Cucun Very Angkoso, S.T., M.T.","Dosen Pembimbing II :Ari Kusumaningsih, S.T., M.T.","Komunikasi merupakan hal yang sangat penting dalam kehidupan bermasyarakat, dan semua orang pasti membutuhkan komunikasi sebagai sarana bersosialisasi dengan orang lainnya, tak terkecuali mereka yang memiliki keterbatasan fisik, tuna rungu dan tuna wicara misalnya. SIBI menupakan suatu bahasa yang menggunakan gerakan tangan dan ekspresi wajah, yang merupakan suatu alat komunikasi bagi penderita tuna rungu dan tuna wicara.Dengan latar belakang tersebutlah penelitian ini dilakukan. Penelitian ini bertujuan untuk dapat membuat sistem pengenalan abjad jari pada SIBI, mulai dari abjad “A” hingga “Z”. Metode yang digunakan dalam penelitian ini adalah metode ekstraksi fitur Principal Component Analysis dan pengukuran jarak kedekatan menggunakan Euclidean Distance. Penelitian ini menggunakan 1092 data citra yang akan digunakan sebagai data training dan testing untuk proses uji coba pada sistem yang telah dibuat. Dengan menggunakan metode ekstraksi fitur PCA dan penghitungan jarak dengan Euclidean Distance, dari tiga skenario pengujian yang telah dilakukan pada penelitian ini, menghasilkan tingkat akurasi sebesar 77.11% untuk uji coba dengan memisahkan data training menjadi dua, yaitu data training untuk semua huruf kecuali “J” dan “Z” dan data training huruf “J” dan “Z” saja."
Manajemen Workflow Layanan Akademik Berbasis Business Process Management System (BPMS),Penulis : Didik Mawardi,"Dosen Pembimbing I : Hermawan S.T., M.Kom","Dosen Pembimbing II :Yeni Kustiyahningsih, S.Kom., M.Kom","Layanan akademik merupakan usaha yang dilakukan oleh perguruan tinggi untuk memberikan kemudahan pada pemenuhan kebutuhan mahasiswa dalam hal yang berkaitan dengan kegiatan akademik. Untuk mendapatkan suatu layanan akademik yang efektif dan efisien diperlukan pemodelan dengan menggunakan BPMS. BPMS menyediakan visualisasi model proses bisnis dengan berbagai fasilitas pendukung runtime service, yang mampu menjembatani antara kebutuhan strategi bisnis dan teknologi informasi. Melalui penggunaan BPMS yang didukung pemodelan yang praktis mampu mengoptimalkan efisiensi penggunaan waktu, tenaga dan biaya baik selama proses pembangunan maupun implementasinya. Dari model dan desain yang digunakan pada penelitian ini didapatkan implementasi sistem yang handal untuk transaksi real time yang memenuhi kebutuhan proses bisnis yang kompleks, yaitu pada layanan akademik perguruan tinggi."
"APLIKASI SISTEM PENDUKUNG KEPUTUSAN DALAM PENENTUAN BEASISWA BIDIK MISI DENGAN PERBANDINGAN METODE ANALITYCAL HIERARCY PROCESS (AHP) DAN ELIMINATION AND CHOICE TRANSLATION REALETY (ELECTRE)
	(Studi K",Penulis : ARDIANSYAH ZULKARNAIN,"Dosen Pembimbing I : RIZA ALFITA, S.T, M.T","Dosen Pembimbing II :YENI KUSTIYAHNINGSIH, S.Kom, M.Kom","Pemerataan dalam akses ke perguruan tinggi jenjang pendidikan menengah, sampai saat ini masih merupakan masalah di negara ini. Banyak lulusan jenjang pendidikan menengah yang berprestasi dan merupakan calon mahasiswa potensial tidak dapat melanjutkan ke jenjang pendidikan tinggi karena berasal dari kalangan keluarga yang kurang mampu secara ekonomi, menghadapi kendala seperti inilah program terbaru yang dikelola DIKTI adalah berupa solusi beasiswa bidik misi. Dengan perbandingan antara Metode Analitycal Hierarcy Process (AHP), untuk menyusun suatu struktur hierarchy, menentukan nilai prioritas kriteria dan Elimination and Choice Translation Realety (Electre) digunakan pada kondisi dimana alternatif yang kurang sesuai dengan kriteria dieleminasi, dan alternatif yang sesuai dapat dihasilkan. Berdasarkan uji coba dengan menggunakan data bidik misi tahun 2011, telah dapat dibuat suatu sistem pengambilan keputusan dalam prosentase ketepatan antara sistem dengan kondisi real, untuk metode  AHP 83.1 % dan metode Electre 49.01 %.
Keyword : AHP, Electre, Bidik Misi, Consistency,  Kriteria dan Nilai Prioritas."
DESAIN DAN IMPLEMENTASI INFRASTUKTURE AS A SEVICE CLOUD COMPUTING MENGGUNAKAN PROXMOX,Penulis : AHMAD RUDHIYUL HAQ,"Dosen Pembimbing I : Hermawan S.T., M.Kom","Dosen Pembimbing II :Firdaus Solihin. S.Kom.,M.Kom","Kebutuhan akan sumber daya teknologi di bidang software dan hardware semakin besar, sedangkan investasi akan sumber daya tersebut membutuhkan waktu, biaya, dan tenaga yang tidak mungkin didapat dalam waktu yang singkat. Solusinya adalah dengan menggunakan teknologi cloud computing Infrastructure as a Service. IaaS cloud computing adalah teknologi yang memberikan sumberdaya teknologi informasi dasar, yang meliputi media penyimpanan, processing power, memory, sistem operasi, dan kapasitas jaringan yang dapat digunakan oleh pengguna  cloud client. Dengan teknologi ini pengguna dapat memenuhi semua kebutuhan sumber daya komputasi tanpa mengorbankan waktu, biaya dan tenaga, dikarenakan pengguna hanya meminta layanan yang dibutuhkan kepada penyedia cloud. Pada penelitian ini, diimplementasikan  cloud computing  dengan menggunakan  proxmox yang merupakan  operating sistem  open source dengan kemampuan Infrastructure as a Service  (IaaS). Infrastructure as a Service dalam proxmox menggunakan teknologi virtual server sehingga utilitas dari hardware server menjadi maksimal. Server proxmox saat menjalankan virtual machine secara bersama dengan sistem operasi windows xp, mampu menjalankan 17 virtual machine sekaligus, sedangkan saat menjalankan sistem operasi ubuntu 9.10 mampu menjalankan 18 virtual machine sekaligus. Dan saat menjalankan ftp server server proxmox mampu menjalankan 10 virtual machine sekaligus."
Sistem Informasi Manajemen Beasiswa Fakultas Teknik Universitas Trunojoyo dengan menggunakan Metode F--AHP,Penulis : Handika Akbar Rijal,Dosen Pembimbing I : Bain Khusnul Khotimah,Dosen Pembimbing II :Hermawan,"Sesuai dengan peraturan yang telah ditentukan oleh pihak pemberi beasiswa terhadap penerima beasiswa, maka diperlukan kriteria-kriteria untuk menentukan siapa yang akan terpilih untuk menerima beasiswa. Pembagian beasiswa dilakukan oleh beberapa lembaga untuk membantu seseorang yang kurang mampu ataupun berprestasi selama menempuh studi. Untuk membantu penentuan dalam menetapkan seseorang yang layak menerima beasiswa maka dibutuhkan Multiple Criteria Decision Making (MCDM) untuk mempertimbangkan nilai terbesar dalam memperoleh factor kompleks yang berdasarkan pada asumsi sifat subyektifnya lebih banyak. 
Fuzzy Analytic Hierarchy Process (FAHP) merupakan penggabungan metode Analitic Hierarchy Proses dengan pendekatan Fuzzy yang relatif terbaru yang cocok dengan permasalahan yang berhubungan dengan sistem saling ketergantungan, dan ini sangat efisien dan relevan jika sistem di gunakan serta di berlakukan di fakultas teknik universitas trunojoyo dengan beberapa faktor kriteria dan subkriteria serta skala perbandingan berpasangan yang di ajukan oleh stakeholder, untuk menganalisa validitas penerima beasiswa. 
Berdasarkan hasil uji coba sistem, terdapat perbedaan selisih hasil rekomendasi dari sistem, terhadap data aktual, dan dari beberapa beasiswa yang ada, beasiswa magang  yang dapat di analisa dengan perolehan 70,58 %.

Kata kunci : FAHP, Pengambilan keputusan multi kriteria, seleksi beasiswa."
PENERAPAN ALGORITMA GREEDY PADA STRATEGI SERANG UNIT PLAYER DALAM GAME TOWER DEFENSE,Penulis :  Adamas Galleh Mulyawan,"Dosen Pembimbing I :  Arik Kurniawati, S.Kom., M.T.","Dosen Pembimbing II :Ari Kusumaningsih, S.T., M.T.",
RANCANG BANGUN APLIKASI MEDIA PEMBELAJARAN HURUF ALFABET UNTUK PERANGKAT MOBILE ANDROID,Penulis : Heru Prayogo,Dosen Pembimbing I : Cucun Very Angkoso S.T. M.T,Dosen Pembimbing II :Ari Kusumaningsih S.T. M.T.,"Media pembelajaran merupakan salah satu solusi untuk mempermudah penyampaian pesan yang dimaksud dalam sebuah materi pembelajaran karena akan mempercepat anak didik untuk memahami pelajaran atau materi yang dimaksud. Penggunaan perangkat mobile berbasis sistem operasi Android sebagai media pembelajaran sudah banyak dikembangkan karena aplikasinya memiliki tampilan yang user friendly dengan interaksi layar sentuh yang  menarik untuk selalu digunakan terutama oleh anak-anak.
Dalam media pembelajaran yang dikembangkan, terdapat pengenalan pola dari karakter alfabet yang berfungsi untuk menguji pemahaman karakter dari pengguna setelah mempelajari bentuknya lewat tutorial. Pengujian dilakukan secara langsung dengan menuliskan bentuk dari huruf kapital. Dengan menggunakan mesin pengenalan pola yang telah dikembangkan oleh Tesseract, mesin open source yang umum digunakan sebagai Optical Character Recognition (OCR) akan dilakukan koreksi dari huruf kapital yang ditulis.
Aplikasi media pembelajaran berfungsi dengan baik pada perangkat dengan berfungsinya semua tombol dan atribut aplikasi. Mesin Tesseract yang digunakan memiliki tingkat akurasi pengenalan 100% pada huruf kapital dengan jenis Arial, Calibri dan Times New Roman. Selain itu aplikasi tersebut juga memiliki respon postif dari anak-anak yang telah menggunakannya. 100% dari sampel uji coba menyatakan bahwa aplikasi tersebut menarik dan membantu dalam mengenal huruf alfabet."
Pencarian String Menggunakan Algoritma Boyer Moore Pada Dokumen,Penulis : Puspita Ika Putri Editya,"Dosen Pembimbing I : Eza Rahmanita, S.T., M.T.","Dosen Pembimbing II :Meydia Koeshardianto, S.Si., M.T.","Proses pencarian merupakan salah satu kegiatan penting dalam pemrosesan data. Proses pencarian dapat menghabiskan waktu jika ruang pencariannya besar, karena"
