Judul,Penulis,Pembimbing 1,Pembimbing 2,Abstrak
ANALISA BALANCED SCORECARD PROJECT PERFORMANCE PADA PROJECT INTEGRATION AND SCOPE MANAGEMENT MENGGUNAKAN FUZZY ANALYTIC NETWORK PROCESS,Penulis : ACHMAD FAUZI,"Dosen Pembimbing I : Hermawan,S.T., M.Kom","Dosen Pembimbing II :M. Kautsar S, Skom., M. MT","Manajemen proyek merupakan upaya untuk merencanakan, mengatur dan melaksanakan proyek secara optimal untuk mencapai sasaran yang ditentukan. Pelaksanaan proyek yang sesuai dengan standar prosedur akan menghasilkan hasil yang optimal. Berdasarkan hal tersebut, Untuk memenuhi standar proyek, penelitian ini mengimplementasikan framework standar manajemen proyek berdasarkan Project Management Body Of Knowledge(PMBOK) yang difokuskan pada domain Project Integration dan Scope Management. Penelitian ini ditujukan untuk mengintegrasikan domain PMBOK sehingga mampu menganalisa performa proyek dengan menggunakan Balanced ScoreCard(BSC). Key Performance Indicator(KPI) pada perspektif BSC diperoleh dari pengukuran kinerja masing- masing domain fungsional. Pembobotan KPI dilakukan menggunakan Fuzzy Analytic Network Process(FANP). Hasil BSC akan dijadikan sebagai acuan untuk mengetahui performa proyek. Uji coba sistem dilakukan menggunakan data proyek implementasi SAP PT. Semen Gresik Tbk. Hasil uji coba fungsionalitas sistem berdasarkan PMBOK adalah 81,25% sedangkan berdasarkan user adalah sebesar 75%. Nilai perspektif BSC pada keempat kuadran adalah sebagai berikut ,  finance: 66, 22%, Internal process: 23 ,00%, learning and growth:11% dan customer:0%.

Kata Kunci  : ERP, Project Integration and Scope Management, Balanced Scorecard(BSC), Fuzzy Analytic Network Process (FANP)."
ANALISIS JEJARING SOSIAL DALAM PENENTUAN CENTRALITY PADA MEDIA SOSIAL DENGAN VISUALISASI GRAF TAK BERARAH(UNDIRECTED GRAPH),Penulis : NUR ISLAMI SYABANIYAH,"Dosen Pembimbing I : MULA'AB M,S.Si.,M.Kom.,",Dosen Pembimbing II :,"Perkembangan internet yang pesat membuat semakin bertambah pula jumlah pengguna internet, khususnya pengguna jejaring sosial facebook. Selain digunakan untuk bertukar informasi, facebook digunakan sebagai media untuk menawarkan barang dagangan(jual-beli online). Online shop yang berkembang saat ini memanfaatkan facebook untuk melakukan promosi sehingga dapat mempermudah pembeli melihat katalog barang dan melakukan penawaran. Pencarian tokoh sentral dalam facebook dapat membantu online shop sehingga promosi lebih merata. Penelitian ini menganalisis aktor sentral pada facebook dengan menggunakan teori sosial network analysis(SNA) dan centrality. Penentuan aktor sentral dilakukan dengan menghitung sentralitas kedekatan(closeness) dan sentralitas keantaraan (betweenness).Aktor dengan sentralitas kedekatan tertinggi lebih cepat menyebarkan informasi karena aktor tersebut memiliki jarak terdekat dengan aktor lainnya. Sedangkan aktor dengan sentralitas keantaraan tertinggi dapat menyebarkan informasi terhadap aktor yang terhubung langsung dengannya atau tidak. Pada penelitian ini dilakukan pencarian aktor sentral pada akun 100005099490481 yang memiliki pertemanan 145. Hasil penelitian menunjukkan nilai closeness tertinggi terdapat pada id 117 dengan nilai 0.823. Nilai betweenness tertinggi pada id 130 dengan nilai 18.898. Dengan menerapkan teori SNA, hasil perhitungan yang divisualisasikan ke dalam graf menunjukkan bahwa id dengan nilai closeness dan betweenness tertinggi sangat berperan penting dalam menghubungkan aktor yang satu dengan yang lain dalam cluster jaringan."
Aplikasi Telemonitoring Obyek Wisata Menggunakan Augmented Reality Berbasis Lokasi,Penulis : Ilfin ardini,"Dosen Pembimbing I : cucun very angkoso, S.T., M.T.","Dosen Pembimbing II :Ari Kusumaningsih, S.T., M.T.","Pariwisata merupakan salah satu sektor penting untuk memajukan suatu daerah. Sehingga banyak orang yang berupaya untuk memajukan pariwisata daerahnya. Upaya untuk memajukan pariwisata tersebut yaitu dengan memanfaatkan kemajuan teknologi. Salah satunya dengan memanfaatkan teknologi Augmented Reality (AR) dan sensor-sensor yang ada pada device android yaitu Global Positioning System (GPS), kompas, dan akselerometer. Teknologi Augmented Reality (AR) digunakan untuk memvisualisasikan obyek wisata dalam bentuk marker ikon wisata dengan bantuan kamera pada device, sensor Global Positioning System (GPS) digunakan untuk mengetahui posisi pengguna yang kemudian sistem dapat menampilkan obyek wisata terdekat dengan pengguna melalui marker ikon wisata, sensor kompas digunakan sebagai petunjuk arah yang nantinya sistem dapat memunculkan marker ikon wisata yang ada pada arah tertentu, dan akselerometer digunakan untuk menstabilkan posisi marker ikon wisata agar tetap berada di depan pengguna meskipun orientasi device berubah-ubah. Penelitian ini bertujuan untuk menghasilkan suatu simulasi aplikasi yang menunjang dan mempermudah pengguna untuk mendapatkan detail informasi-informasi yang hanya didapat pengguna jika pengguna mengunjungi lokasi dengan memanfaatkan teknologi Augmented Reality (AR) dan sensor-sensor yang ada pada device android. Aplikasi ini dirancang menggunakan sistem client server dimana database MySQL sebagai server yang menyediakan informasi-informasi obyek wisata dan device android sebagai client yang melakukan permintaan untuk mengakses data. Berdasarkan implementasi yang dilakukan dapat disimpulkan bahwa aplikasi ini berjalan dengan baik dan dapat memberikan informasi yang akurat."
Interaksi MArkerless Augmented Reality Sebagai Media Buku Menu pada SONNEN Cafe Berbasis OS Android,Penulis : Mochahmad Dannish Koosrivanto,"Dosen Pembimbing I : Arik Kurniawati, S.Kom., M.T.","Dosen Pembimbing II :Ari Kusumaningsih, S.T., M.T.","Dalam perkembangannya semakin banyak café menggunakan media 2D sebagai media promosi dan tampilan produk dalam penggunaan buku menu. Augmented reality (AR) yang merupakan konsep penggabungan antara obyek virtual 2D atau 3D pada dunia maya ke dunia nyata, penerapan Augmented reality dalam buku menu juga akan membuat promosi produk lebih menarik dan menjadi hal baru di bidang advertising. Dengan menggunakan metode markerless pada aplikasi Augmented reality akan membuat aplikasi lebih bervariasi.
Untuk mengembangkan Augmented reality banyak sekali library pendukung yang dapat di gunakan. Vuforia SDK adalah salah satunya. Dimana Vuforia SDK merupakan library pendukung Augmented reality yang dapat berintegrasi dengan Unity 
Berdasarkan sistem AR pada Virtual menu’s Sonnen Cafe, obyek animasi dapat berinteraksi dan menimbulkan animasi gerak, perubahan texture serta audio dengan uji lapangan responden memilih 80% aplikasi dapat di terapkan pada Sonnen café, Dengan tingkat waktu proses rendering obyek aplikasi terbaik berkisar 2,31 detik pada uji device Android yang di terapkan pada sistem secara Augmented reality."
IMPLEMENTASI DAN ANALISA HIDS (HOST BASED INTRUSION DETECTION SYSTEM) DENGAN SNORT UNTUK MENCEGAH DDOS (DISTRIBUTED DENIAL OF SERVICE),Penulis : Masdian,"Dosen Pembimbing I : Dwi Kuswanto, S.Pd.,M.T.","Dosen Pembimbing II :Iwan Santosa, S.T, M.T.","HIDS (Host based Intrusion Detection System) adalah salah satu jenis IDS (Intrusion Detection System) yang berjalan pada host yang berdiri sendiri atau perlengkapan dalam sebuah jaringan. Sebuah HIDS melakukan pengawasan terhadap paket-paket yang berasal dari dalam maupun dari luar hanya pada satu alat saja dan kemudian memberi peringatan kepada user atau administrator sistem jaringan akan adanya kegiatan-kegiatan yang mencurigakan yang terdeteksi oleh HIDS. DDOS menggunakan banyak host penyerang, untuk menyerang satu host target. Perbedaan dengan serangan DOS biasa, apabila serangan DOS bersifat ""satu lawan satu"", maka untuk DDOS ini menjadi ""satu lawan Banyak"", sehingga pertahanan host target akan lebih mudah dijebol dan dibanjiri traffic sehingga membuat server host menjadi down dan tidak bisa diakses penggunanya. Dengan HIDS, administrator jaringan akan semakin mudah mencegah serangan DDOS. Pada functionality HIDS mampu mendeteksi beberapa variasi serangan yaitu ICMP flood, TCP flood, dan UDP flood. Berdasarkan percobaan yang telah dilakukan rules snort dapat dibuat dengan melakukan perbandingan antara data dari client dan data dari penyerang. Berdasarkan percobaan yang telah dilakukan terjadi kenaikan response time atau lambatnya response time ketika paket data yang dikirim lebih kecil. Ini disebabkan rules snort harus menganalisa paket data yang masuk dalam jangka waktu tertentu agar tidak terjadi false alarm."
KLASIFIKASI DOKUMEN MENGGUNAKAN METODE EXPECTATION MAXIMIZATION,Penulis : Veki Nurkholis,"Dosen Pembimbing I : Mula'ab S.Si., M.Kom","Dosen Pembimbing II :Fika hastarita Rachman S.T., M.Eng","Banyaknya informasi dan dokumen yang ada mendorong manusia untuk mencari bagaimana untuk mendapatkan informasi dan dokumen yang diinginkan dalam waktu yang singkat. Klasifikasi dokumen tugas akhir dapat membantu program studi Teknik Informatika dalam proses pencarian sebuah dokumen dengan cepat dan tepat. Klasifikasi dokumen tugas akhir mengelompokkan dokumen yang sesuai dengan bidang minat masing-masing di dalam jurusan Teknik Informatika Universitas Trunojoyo Madura diantaranya adalah bidang minat sistem informasi dan rekayasa perangkat lunak , multimedia , sistem terdistribusi, komputasi dan kecerdasan buatan dengan menggunakan PCA (Principle Component Analisis) sebagai pereduksi dimensi dokumen proposal seminar tugas akhir, dimana PCA ini akan mengestraksi fitur dari dokumen sehingga hanya mengambil ciri penting dari dokumen untuk diklasifikasikan menggunakan metode Expectation Maximization, dimana metode Expectation Maximization merupakan salah satu metode dalam pengklasifikasian. Pengujian akan memakai 30 dokumen proposal seminar tugas akhir yang dibagi menjadi dua bagian yaitu dokumen training dan dokumen testing.  yaitu 17 dokumen untuk data training dan 13 dokumen untuk dokumen test. Pengujian klasifikasi dengan Expectation Maximization menghasilkan nilai rata-rata untuk precision sebesar 0,81 dan recall sebesar 0,87 yang memiliki tingkat akurasi sebesar 85% dan tingkat error rate sebesar 15%.
Kata Kunci : Klasifikasi, PCA, Expectation maximization."
PENGENALAN KARAKTER PLAT NOMOR SEPEDA MOTOR MENGGUNAKAN METODE CONNECTED COMPONENT ANALYSIS DAN EUCLIDEAN DISTANCE,Penulis : Rusmiati,"Dosen Pembimbing I : Rima Tri Wahyuningrum,S.T,M.T.","Dosen Pembimbing II :Bain Khusnul Khotimah S.T, M.Kom","Dalam suatu area parkir sebuah gedung instansi atau pertokoan, selalu ditemukan petugas pintu masuk parkir yang bertugas mencatat plat nomor kendaraan pada karcis yang berfungsi sebagai karcis masuk yang biasanya dilakukan secara manual (dilihat dan dicatat), sehingga rentan kesalahan. Maka diperlukan adanya suatu sistem pencatat plat nomor kendaraan secara otomatis, sehingga memudahkan dan membantu meningkatkan kecepatan dalam  mencatat plat nomor kendaraan di area parkir supaya lebih efektif dan efisien. Pada penelitian ini dibuat sistem pengenalan karakter plat nomor kendaraan. Pada proses awal dilakukan segmentasi menggunakan metode Connected Component Analysis, setelah itu dilakukan pengenalan menggunakan Euclidean Distance untuk mengukur kemiripan antara data pelatihan (training) dan data ujicoba (testing). Melalui proses testing citra plat nomor ini dapat diketahui. Dari ujicoba yang telah dilakukan menggunakan metode segmentasi Connected Component Analysis berhasil melakukan segmentasi huruf dan angka dengan persentase rata – rata 85.25%. sedangkan pada pengenalan metode Euclidean Distance dapat mengenali karakter dengan tingkat akurasi 58.2%
Kata kunci : Connected Component Analysis, Plat Nomor, Pengenalan Karakter, Euclidean Distance."
"“KLASIFIKASI PENDAPAT MASYARAKAT DUNIA MAYA TERHADAP PARTAI POLITIK DENGAN METODE
EXPECTATION MAXIMIZATION”",Penulis : Habiburrahman,"Dosen Pembimbing I : Mula’ab S.Si., M.Kom","Dosen Pembimbing II :Fika Hastarita R. S.T.,M.Eng","Meningkatnya teknologi informasi semakin memudahkan masyarakat dalam berkomunikasi. Termasuk di antaranya melalui media jejaring sosial. Media jejaring sosial sekaligus menjadi tempat masyarakat dalam menyampaikan pendapatnya. Adanya fasilitas web service memungkinkan dilakukannya crawling untuk mengumpulkan pendapat masyarakat yang tersebar di dunia jejaring sosial Twitter. Sementara metode Expectation Maximization mengklasifikasikan sebuah pendapat berdasarkan kelas yang sudah ditentukan, yakni positif, negatif, dan netral. Selanjutnya pendapat yang telah dikumpulkan ditampilkan dalam bentuk persebaran dalam sebuah peta digital. Persebaran pendapat-pendapat tersebut didasarkan pada daerahnya.Maka dari itu dibutuhkan sebuah aplikasi yang dapat menghimpun pendapat masyarakat, mengklasifikasikannya, kemudian menampilkannya dalam bentuk persebaran dalam peta secara realtime. Diharapkan dengan adanya aplikasi ini menjadikannya salah satu referensi dalam mengetahui persebaran pendapat masyarakat. Hasil uji coba menunjukkan bahwa data training dalam waktu yang jauh berbeda terhadap data testing memeberikan hasil yang tidak maksimal dengan nilai precision 0 %. Sementara hasil maksimal yang dicapai dengan menggunakan 40 data training masih memiliki nilai akurasi 64, 58 % untuk data training dan testing pada waktu yang sama atau berdekatan. Hal ini karena twitter bertema partai bersifat sangat dinamis setiap waktunya. Kemudian untuk hasil visualisasi pada peta hanya memperoleh satu tweet yang dapat ditampilkan karena minimnya user dalam memberikan akses garis lintang dan bujurnya."
SISTEM PEROLEHAN CITRA BERBASIS ISI BERDASARKAN TEKSTUR MENGGUNAKAN METODE GABOR FILTER DAN EUCLIDEAN DISTANCE,Penulis : BASIR QIYAM JULIANDI,"Dosen Pembimbing I : Dr. ARIF MUNTASA, S.Si., MT","Dosen Pembimbing II :FITRI DAMAYANTI, S.Kom., M.kom.","Saat ini pencarian citra berbasis teks sudah tidak efektif lagi karena adanya penilaian subjektif dari pengguna dalam merepresentasikan suatu citra. Karena itu diperlukan suatu sistem yang dapat menangani pencarian citra menggunakan query berupa citra atau disebut Sistem Perolehan Citra berbasis Isi (SPCI) atau Content Based Image Retrieval (CBIR). Dengan hal yang seperti ini pada CBIR meskipun ada yang memodifikasi atau merubah nama filenya, tidaklah membuat image searching menjadi rancu karena hal ini tidak didasarkan atas teks atau nama dari sebuah file melainkan berdasarkan ciri baik warna, bentuk maupun tekstur. 
 Dalam  penelitian  Tugas Akhir ini menggunakan ciri tekstur sebagai proses pencarian kemiripan dari delapan kelas citra yang  berbeda yaitu: bangunan, bus, dinosaurus, gajah, gunung, kuda, mawar, dan pantai sebagai objek perolehan citra berbasis isi. Sistem dibangun dengan proses utamanya yaitu ekstraksi fitur tekstur dengan menggunakan metode Gabor Filter. Sehingga dari hasil ekstraksi fitur dilakukan pengukuran kemiripan dengan feature vector citra yang sudah diekstraksi terlebih dahulu yang tersimpan dalam database dengan menggunakan metode Euclidean Distance. Citra query dan citra database yang dipergunakan sebanyak 200 citra dengan delapan kelas citra didalamnya. 
Dari uji coba aplikasi menggunakan pengukuran kemiripan Euclidean Distance dengan nilai threshold=0,02 diperoleh akurasi rata-rata presisi sebesar 0.46 pada data pelatihan 190 dan data uji coba 10 dengan ukuran kernel 3x3 dan jumlah citra yang ditampilkan sebanyak 15 citra termirip dengan citra query dan pengenalan terbaik pada kelas bangunan yaitu dengan akurasi presisi 60% .

Kata Kunci: Tekstur, Sistem Perolehan Citra Berbasis Isi, Gabor Filter, Euclidean Distance."
PERAMALAN STOK OBAT MENGGUNAKAN JST ALGORITMA BACKPROPAGATION,Penulis : Taufik Ramadhani,"Dosen Pembimbing I : Moch. Kautsar Sophan, S.Kom., M.MT","Dosen Pembimbing II :Fika Hastarita Rachman, ST., M.Eng","Obat merupakan salah satu bagian penting untuk seseorang yang sakit dan yang membutuhkan perawatan. Peningkatan jumlah pasien yang tidak terduga di Rumah Sakit menyebabkan kebutuhan obat yang tidak teratur. Oleh karena itu diperlukan sistem peramalan yang mampu meramalkan pembelian obat pada periode berikutnya. Peramalan ini menggunakan metode Jaringan Syaraf Tiruan dengan algoritma Backpropagation untuk meramalkan jumlah pemesanan periode berikutnya. Data obat dihitung menggunakan ROP atau Re-order Point untuk ditentukan tingkat levelnya, apakah aman atau tidak aman dengan berdasarkan variabel yang mendukung seperti, stok terkini, safety stok dan lead time beserta data transaksi yang ada. Untuk proses perhitungan ROP nya yang mempengaruhi lebih besar atau lebih kecil dari stok obat terkini yaitu safety stok dan lead time. Jika obat tersebut ada pada lebel tidak aman, maka akan dilanjutkan ke proses peramalan. Data yang digunakan adalah data penjualan  yang terdiri dari 12 bulan dan masing-masing bulan ada 4 minggu. Dengan MSE sebesar 0,1 dibutuhkan waktu sekitar 64 detik dengan momentum 0,1 learning rate 0,1 dan epoch 5000 dari skenario ujicoba sistem."
"RANCANG BANGUN APLIKASI
NETWORK ADMISSION CONTROL (NAC) BERBASIS SHORT MESSAGE SERVICE (SMS)",Penulis : Achmad Hasan Al Banna,"Dosen Pembimbing I : Dwi Kuswanto S.Pd. ,M.T.","Dosen Pembimbing II :Iwan Santosa S.T.,M.T.","Network Access Control (NAC) merupakan teknologi keamanan jaringan yang melakukan otentikasi terlebih dahulu sebelum diperbolehkan. Otentikasi adalah proses dimana validasi user terlebih dahulu saat memasuki sistem. Firewall merupakan lalu lintas jaringan yang berusaha masuk ke komputer. Firewall tidak mengijinkan komputer tersebut masuk apabila tidak bisa memenuhi otentikasi yang telah ditetapkan. Nama dan password dicek oleh sistem bahwa user tersebut adalah autentik atau asli. Firewall salah satunya menggunakan username dan password yang statis atau selalu sama sangat rentan terhadap penyalahguanaan terhadap pihak yang tidak bertanggung jawab. Dengan adanya tantangan tersebut maka diperlukan suatu hal diluar nama dan password user, yaitu otentikasi password tambahan berupa token. Otentikasi password tambahan atau token ini berubah-ubah sesuai dengan waktu login.Token di generate memakai enkripsi md5 yang ditambahkan dengan time stamp. Kompter user terlebih dulu memasuki firewall, apabila user mendapat ijin oleh firewall maka user akan memasuki sistem dengan memasukkan username dan password dan ditambahkan token yang telah ditentukan oleh sistem. Metode token ini dikenal dengan One Time Password (OTP), merupakan sebuah password yang berubah-ubah dalam waktu tertentu.Token ini dikirim melalui short message service (SMS) gateway.Rancang bangun NAC dengan tambahan One Time Password(OTP) ini diharapkan membantu administrator membangun keamanan server jaringan."
CLUSTERING PENGELOMPOKAN TINGKATAN KELAS DENGAN METODE SOM (SELF ORGANIZING MAP) MAHALANOBIS,Penulis : Ira agustin Sasintorini,"Dosen Pembimbing I : Bain Khusnul Khotimah.,ST.M.Kom.","Dosen Pembimbing II :Firli Irhamni,ST.,M.Kom.","Dalam penyelenggaraan pendidikan formal untuk lebih mengarahkan siswa berdasarkan kemampuan akademiknya membutuhkan data real, Data yang sudah ada terkadang tidak digunakan secara optimal karena keterbatasan ilmu dan waktu maka dari itu disini dilakukan penelitian pengolahan data dengan mengimplementasikan Algoritma SOM (Self Organizing Map) dengan menggunakan Mahalanobis Distance sebagai pengukuran jarak antar cluster dan Indeks Dunn digunakan untuk memvalidasi hasil analisa data dari SOM (Self Organizing Map), sehingga didapat nilai yang lebih akurat. Data yang digunakan adalah rata-rata nilai NEM, Semester 1 dan Semester 2 dari Mata Pelajaran Bahasa Indonesia, Bahasa Inggris, Matematika, Biologi, Fisika, Kimia, Ekonomi, Geografi, Sosiologi, PPkn, TIK, Agama, Conversation, Penjaskes dan Seni. Dari data tersebut memetakkan dataset kedalam  tiga Cluster yaitu Intensif, Reguler Advanced, dan Reguler Menengah ke bawah. Nilai terkecil pada pemvalidasian cluster dengan Index Dunn menggunakan tiga Cluster pada 153 data training berada pada  penetapan nilai Distance = 10 Learning 1 dan MSE = 1 dengan nilai Indeks Dunn = -0.38376688860749 dengan hasil akurasi 47,05% sedangkan hasil akurasi terbaik sebesar 60,78% dengan Learning Rate 0,3."
SISTEM INFORMASI PENJADWALAN MATA PELAJARAN MENGGUNAKAN METODE ALGORITMA GENETIKA DAN CONSTRAINT SATISFACTION,Penulis : Arini Warandeka,"Dosen Pembimbing I : Fika Hastarita, S.T.,M.Eng","Dosen Pembimbing II :Andharini Dwi Cahyani, S.Kom.,M.Kom","Sekolah Menengah Kejuruan atau yang sering disebut SMK merupakan bentuk satuan pendidikan formal yang memiliki banyak sekali program keahlian.  Di SMKN 2 Bangkalan terdapat banyak program keahlian, yang tentunya memiliki banyak sekali mata pelajaran namun masih memiliki ruang yang terbatas. Selain itu, terdapat berbagai aspek yang berkaitan dalam penjadwalan tersebut yang harus dilibatkan antara lain kelas, hari, waktu, guru pengajar, pelajaran dan penjadwalan mata pelajaran yang diharapkan dapat  merata setiap harinya untuk setiap kelas. Untuk mengatasi permasalahan ini diperlukan sistem informasi penjadwalan mata pelajaran untuk membantu pembuatan penjadwalan agar lebih mudah dan cepat dan menghasilkan jadwal mata pelajaran yang optimal. Metode yang dapat digunakan untuk menyelesaikan permasalahan tersebut adalah dengan menggunakan pendekatan Algoritma Genetika yang dipadukan dengan metode Constraint Satisfaction Problem. Dalam metode Algoritma Genetika terlebih dahulu akan dilakukan pembuatan kromosom, perhitungan nilai fitness, reproduksi sampai dihasilkan jadwal. Jadwal yang dihasilkan tersebut selanjutnya akan diproses dengan menggunakan metode Constraint Satisfaction Problem  sehingga didapatkan jadwal dengan tingkat error yang lebih kecil. Dari hasil uji coba yang dilakukan dalam penelitian ini, diperoleh tingkat error sebesar 0,005 dengan jumlah generasi sebanyak 250 dan iterasi sebanyak 500 dengan Pc 0,01 dan Pm 0,5.

Kata Kunci:  Penjadwalan, Algoritma Genetika, Constraint Satisfaction Problem"
SEGMENTASI PEMBULUH DARAH RETINA PADA CITRA FUNDUS MENGGUNAKAN OPERASI MORFOLOGI,Penulis : AKHMAD NUVAIL,"Dosen Pembimbing I : Dr. Arif Muntasa S.Si., M.T.","Dosen Pembimbing II :Dr. Indah Agustien S.Kom., M.Kom.","Segmentasi adalah suatu proses untuk mengekstraksi atau menampilkan objek tertentu pada citra sehingga obyek tersebut terlihat lebih dominan. Pada penelitian Tugas Akhir ini  proses segmentasi menggunakan Operasi Morfologi yang diantaranya adalah Morfologi Bottom-Hat, Morfologi Dilasi, dan Morfologi Opening. Dalam penelitian ini ada dua tahapan proses segmentasi pembuluh darah retina pada citra fundus ini, yakni : tahapan Preprocessing dan tahapan Segmentasi. Untuk tahapan Preprocessing sendiri terdapat beberapa proses diantaranya : konversi citra RGB ke Green Channel agar mendapatkan komposisi saturasi yang tepat, perbaikan citra menggunakan Contrast Limited Adaptive Histogram Equalization (CLAHE) yaitu dengan meningkatkan nilai kontras pada citra Green Channel, kemudian ada proses filtering citra menggunakan 2D-Gaussian Filter yang berfungsi untuk memperjelas obyek pada citra. Untuk tahap kedua yaitu segmentasi citra yang terdiri dari beberapa proses diantaranya : Morfologi Bottom-Hat, Thresholding, Binerisasi, Adaptive Median Filter, Dilasi, Opening, dan perhitungan akurasi menggunakan Balanced Accuracy. Dari hasil uji coba yang dilakukan pada 20 citra Digital Retinal Image for Vessel Extraction (DRIVE) diperoleh hasil akhir segmentasi pembuluh darah pada retina dengan akurasi sebesar 85,97%. Operasi Morfologi terbukti dapat menghasilkan citra hasil segmentasi  yang cukup baik dengan akurasi yang tinggi."
Penerapan Regular Expression Untuk Mengelompokkan Niche Blog,Penulis : Muhammad Darul Mukhlasin,"Dosen Pembimbing I : Firdaus Solihin S.Kom., M.Kom","Dosen Pembimbing II :Bain Khusnul Khotimah S.T., M.Kom","Internet merupakan kebutuhan pokok bagi banyak orang di era informasi. Informasi yang terdapat di internet sangat banyak. Search engine merupakan sistem yang mampu melakukan pencarian dan pengambilan informasi berdasarkan kata kunci yang dimasukkan oleh pengguna. Blog merupakan salah satu penyumbang informasi yang notabene dibuat oleh para blogger. Jumlah blogger di Indonesia semakin bertambah, berbanding lurus dengan jumlah informasi di internet. Dari kondisi tersebut diperlukan mekanisme mempercepat proses pengambilan informasi dari pemilahan blog berdasarkan kategori yang telah ditentukan sebelumnya. Web crawler aplikasi yang berfungsi mengambil informasi yang diperlukan dengan cara menjelajahi halaman situs blog kemudian disimpan dalam database. Proses pengambilan halaman web dilakukan pengecekan bahasa menggunakan regular expression dan daftar stopword untuk tujuh kategori yang ditentukan berdasarkan niche blog : tips dan trik komputer, kuliner nusantara, sepak bola, petualangan indonesia, kesehatan Ibu dan anak, handphone dan gadget, fashion wanita. Niche blog adalah aktivitas blogging yang dilakukan oleh para blogger untuk membuat blog bertopik spesifik. Dengan mengaplikasikan konsep web crawler, penelitian ini mampu menentukan niche blog sesuai dengan tujuh kategori yang telah ditentukan dengan mengujikan 10 kata kunci dan daftar stopword. Dari hasil ujicoba, dapat diambil kesimpulan penggunaan 3 kunci mendapatkan hasil paling maksimal.
Keywords: Niche Blog, Regular Expression, Web Crawler, Search Engine"
